<?xml version="1.0" encoding="iso-8859-1" ?>
<!DOCTYPE pattern SYSTEM "manifest.dtd">
<pattern id="requestresponse"
         name="Requestresponse"
         topCategorie="SCA"
         subCategorie="Micro Pattern">

  <comment>
    Micropattern- Define a type of interaction where the calling component sends a message to the called component.THe calling component expects an immediate response for each message that's sent.
  </comment>

  <!-- ====================================================================== -->
  <role name="Requestresponse" min="1" max="1">
    <comment>
      <li>defines an interface offering services to the requesting component.</li>
    </comment>
  </role>

  <!-- ====================================================================== -->
  <role name="ServerImpl" min="1" max="1">
    <comment>
      <li>implements the request services by providing the RequestResponse interface.</li>
    </comment>
    <dependence roles="Requestresponse" />
  </role>

  <!-- ====================================================================== -->
  <role name="ClientRequestresponseImpl" min="1" max="1">
    <comment>
      <li>maintains a reference to a RequestResponse service type.</li>
      <li>calls a service of the Server component and waits for the resutl</li>
    </comment>
    <dependence roles="Requestresponse" />
  </role>

</pattern>
